{
  "schema_version": "0.1",
  "recipe_id": "RCP_BR_PE_RECIFE_MID_MODERN_RES_CORPUS_001",
  "display_name": "Recife Mid-Modern Residential — Documented Corpus",
  "description": "Receita parcial para o corpus residencial moderno documentado no Recife, sem converter exemplos pesquisados em prevalencia municipal.",
  "status": "partial",
  "recipe_kind": "documented_corpus",
  "scope": {
    "context_anchor_ids": ["CTX_BR_PE_RECIFE_MID_MODERN_RES_CORPUS_001"],
    "geography": {
      "country_code": "BR",
      "subdivision_code": "BR-PE",
      "locality_code_system": "IBGE_MUNICIPALITY",
      "locality_code": "2611606"
    },
    "archetype_ids": ["BLD_RES_HOUSE_DETACHED"],
    "construction_periods": ["mid_modern"],
    "cultural_variants": ["br_pe_recife_modernist_residential_corpus"],
    "corpus_label": "Residencias modernas recifenses documentadas, com foco na producao das decadas de 1950 e 1960",
    "basis_refs": ["KB_RECIFE_LOCATION_001", "KB_RECIFE_CORPUS_001", "KB_RECIFE_SCOPE_TRANSLATION_001"]
  },
  "activation": {
    "state": "corpus_limited",
    "regional_sampling_allowed": false,
    "requires_explicit_corpus_opt_in": true,
    "blocking_codes": ["REGIONAL_PREVALENCE_UNESTABLISHED", "LOCAL_COMPONENT_CATALOG_GAPS"]
  },
  "prevalence": {
    "claim_level": "corpus_only",
    "denominator_status": "unavailable",
    "unit": null,
    "sample_size": null,
    "quantitative_shares": [],
    "basis_refs": ["KB_RECIFE_PREVALENCE_GAP_001"],
    "limitations": "As fontes documentam obras e principios, mas nao fornecem inventario com denominador capaz de sustentar participacoes municipais."
  },
  "family_diversity": {
    "status": "multiple_supported_candidates",
    "minimum_candidate_count": 2,
    "basis_refs": ["KB_RECIFE_ENVIRONMENTAL_RESOURCES_001", "KB_RECIFE_FAMILY_MAPPING_001"],
    "limitations": "Duas traducoes compositivas sao sustentadas pelo corpus; isso nao informa suas frequencias nem exclui outras familias futuras."
  },
  "family_rules": [
    {
      "family_id": "FAM_SHADED_VENTILATED_EDGE_LOWRISE_001",
      "disposition": "eligible",
      "relationship": "supported_candidate",
      "basis_refs": ["KB_RECIFE_ENVIRONMENTAL_RESOURCES_001", "KB_RECIFE_FAMILY_MAPPING_001"],
      "reason": "Sombra, ventilacao permanente e tratamento climatico das aberturas possuem precedentes documentados no corpus."
    },
    {
      "family_id": "FAM_PROTECTED_COURTYARD_LOWRISE_001",
      "disposition": "eligible",
      "relationship": "supported_candidate",
      "basis_refs": ["KB_RECIFE_ENVIRONMENTAL_RESOURCES_001", "KB_RECIFE_FAMILY_MAPPING_001"],
      "reason": "Patios e terracos aparecem entre as solucoes pesquisadas, sem autorizar que toda residencia receba patio."
    }
  ],
  "deferred_features": [
    {
      "feature_id": "RCPDEFER_RECIFE_TILE_OVER_SLAB_ROOF_001",
      "target_kind": "module",
      "slot_codes": ["ROF"],
      "candidate_tags_any": ["tile_over_slab"],
      "candidate_capabilities_all": ["ventilated_roof_cavity_capable"],
      "basis_refs": ["KB_RECIFE_ENVIRONMENTAL_RESOURCES_001"],
      "gap_code": "MISSING_TILE_OVER_SLAB_ROOF_MODULE",
      "reason": "A solucao documentada de telha sobre laje nao possui modulo semanticamente equivalente no catalogo atual."
    },
    {
      "feature_id": "RCPDEFER_RECIFE_VENTILATED_PARAPET_001",
      "target_kind": "module",
      "slot_codes": ["WIN"],
      "candidate_tags_any": ["ventilated_parapet"],
      "candidate_capabilities_all": ["rain_protected_continuous_ventilation_capable"],
      "basis_refs": ["KB_RECIFE_ENVIRONMENTAL_RESOURCES_001"],
      "gap_code": "MISSING_VENTILATED_PARAPET_MODULE",
      "reason": "O peitoril ventilado exige comportamento proprio e nao pode ser substituido por uma janela generica."
    },
    {
      "feature_id": "RCPDEFER_RECIFE_CERAMIC_FACADE_001",
      "target_kind": "material",
      "slot_codes": ["FAC"],
      "candidate_tags_any": ["ceramic_finish"],
      "candidate_capabilities_all": ["exterior_finish_capable"],
      "basis_refs": ["KB_RECIFE_ENVIRONMENTAL_RESOURCES_001"],
      "gap_code": "MISSING_CERAMIC_FACADE_MATERIAL",
      "reason": "A superficie neutra generica nao comprova composicao ceramica nem o desempenho atribuido aos revestimentos documentados."
    },
    {
      "feature_id": "RCPDEFER_RECIFE_PERFORATED_SCREEN_001",
      "target_kind": "module",
      "slot_codes": ["FAC", "CLM"],
      "candidate_tags_any": ["cobogo", "perforated_screen"],
      "candidate_capabilities_all": ["natural_ventilation_capable", "sun_protection_capable"],
      "basis_refs": ["KB_RECIFE_ENVIRONMENTAL_RESOURCES_001"],
      "gap_code": "MISSING_PERFORATED_SCREEN_MODULE",
      "reason": "O catalogo nao possui tela vazada que combine ventilacao e protecao solar com identidade propria."
    }
  ],
  "knowledge": {
    "sources": [
      {
        "source_id": "SRC_IBGE_RECIFE_2611606",
        "source_type": "official_statistical_record",
        "title": "Recife — Cidades e Estados",
        "authors": ["Instituto Brasileiro de Geografia e Estatistica"],
        "publisher": "Instituto Brasileiro de Geografia e Estatistica",
        "year": 2026,
        "url": "https://www.ibge.gov.br/cidades-e-estados/pe/recife.html",
        "accessed_on": "2026-08-28"
      },
      {
        "source_id": "SRC_AMORIM_2001_MODERNISMO_RECIFENSE",
        "source_type": "academic_article",
        "title": "Modernismo recifense: uma escola de arquitetura, tres paradigmas e alguns paradoxos",
        "authors": ["Luiz Manuel do Eirado Amorim"],
        "publisher": "Vitruvius — Arquitextos",
        "year": 2001,
        "url": "https://vitruvius.com.br/revistas/read/arquitextos/01.012/889",
        "accessed_on": "2026-08-28"
      },
      {
        "source_id": "SRC_COSTA_2008_PRODUCAO_MODERNA_RECIFE",
        "source_type": "academic_article",
        "title": "A producao arquitetonica moderna dos primeiros discipulos de uma Escola",
        "authors": ["Alcilia Afonso de Albuquerque Costa"],
        "publisher": "Vitruvius — Arquitextos",
        "year": 2008,
        "url": "https://vitruvius.com.br/revistas/read/arquitextos/09.098/128",
        "accessed_on": "2026-08-28"
      }
    ],
    "statements": [
      {
        "statement_id": "KB_RECIFE_LOCATION_001",
        "kind": "evidence",
        "text": "O IBGE identifica Recife, Pernambuco, pelo codigo municipal 2611606, usado como chave geografica desta receita.",
        "source_ids": ["SRC_IBGE_RECIFE_2611606"],
        "limitations": "O codigo municipal nao delimita sozinho bairros, lotes ou distribuicao de tipos arquitetonicos."
      },
      {
        "statement_id": "KB_RECIFE_CORPUS_001",
        "kind": "evidence",
        "text": "A literatura consultada documenta producao arquitetonica moderna no Recife e inclui residencias projetadas nas decadas de 1950 e 1960.",
        "source_ids": ["SRC_AMORIM_2001_MODERNISMO_RECIFENSE", "SRC_COSTA_2008_PRODUCAO_MODERNA_RECIFE"],
        "limitations": "O corpus publicado nao equivale ao conjunto completo de moradias construidas no municipio."
      },
      {
        "statement_id": "KB_RECIFE_ENVIRONMENTAL_RESOURCES_001",
        "kind": "evidence",
        "text": "Os estudos registram solucoes climaticas em planta e volume, patios, terracos, protecao de esquadrias, revestimentos ceramicos, brises, elementos vazados e peitoris ventilados.",
        "source_ids": ["SRC_AMORIM_2001_MODERNISMO_RECIFENSE", "SRC_COSTA_2008_PRODUCAO_MODERNA_RECIFE"],
        "limitations": "A ocorrencia documentada de um recurso nao prova que ele esteja presente em toda obra nem mede sua frequencia relativa."
      },
      {
        "statement_id": "KB_RECIFE_PREVALENCE_GAP_001",
        "kind": "evidence",
        "text": "As fontes catalogadas descrevem exemplares e principios recorrentes, mas nao apresentam denominador municipal para calcular participacoes entre familias.",
        "source_ids": ["SRC_AMORIM_2001_MODERNISMO_RECIFENSE", "SRC_COSTA_2008_PRODUCAO_MODERNA_RECIFE"],
        "limitations": "A ausencia de denominador vale para este conjunto de fontes e deve ser revista quando um inventario adequado for incorporado."
      },
      {
        "statement_id": "KB_RECIFE_FAMILY_MAPPING_001",
        "kind": "design_hypothesis",
        "text": "O resolvedor associa os recursos documentados de sombra e ventilacao ao prototipo shaded_ventilated_edge e patios protegidos ao prototipo protected_courtyard.",
        "source_ids": [],
        "limitations": "O mapeamento e uma traducao do sistema, nao identifica os prototipos globais como a chamada Escola do Recife."
      },
      {
        "statement_id": "KB_RECIFE_SCOPE_TRANSLATION_001",
        "kind": "design_hypothesis",
        "text": "O rotulo interno br_pe_recife_modernist_residential_corpus restringe a correspondencia ao fixture pesquisado e impede inferencia por clima apenas.",
        "source_ids": [],
        "limitations": "O rotulo nao e uma categoria historiografica e nao deve aparecer como nome publico de estilo."
      }
    ]
  },
  "limitations": [
    "A receita nao pode ser usada para amostragem geral de casas do Recife.",
    "Nenhum percentual ou peso entre familias foi criado sem denominador documentado.",
    "Recursos locais ausentes do catalogo permanecem adiados e nao recebem substitutos genericos silenciosos.",
    "A associacao entre evidencia e familia e uma traducao procedural explicitamente hipotetica."
  ]
}
